{
  "$schema": "https://schemas.stokerhq.app/plugins/v1/plugin.schema.json",
  "schemaVersion": "1.0",
  "key": "org.example.unpacker.variant31",
  "kind": "unpacker",
  "name": "Example unpacker, variant 3.1 (x64)",
  "description": "Removes a fictional DRM wrapper's variant 3.1 from 64-bit executables.",
  "license": "LicenseRef-Example",
  "homepage": "https://example.com/unpacker"
}
